{
  "id": 151435,
  "info": {
    "name": "theatre mode transparent chat- Twitch.tv",
    "description": "Transparent chat, theater / theater mode.\r\nПишите отзывы пожелания.\r\nFeel Free to leave comment about improvements (code examples appreciated).\r\nFACEBOOK.com/Vartan.bg",
    "additionalInfo": "Updated - works for Microsoft Edge now. LUL haHAA\r\n\r\nUpdated: - VOD videos transparent chat and contrast white color text. 06.18.2018\r\n\r\nUpdated: - VOD videos progress bar not intersect with chat now 04.06.2019\r\n\r\nUpdated - customize settings for colors and chat transparency (for myname__)\r\n\r\nUpdated - customize settings for chat size",
    "format": "uso",
    "category": "twitch",
    "createdAt": "2017-11-17T03:34:07Z",
    "updatedAt": "2023-05-03T17:32:24Z",
    "license": "NONE",
    "author": {
      "id": 551655,
      "name": "Vartan Bagdasaryan",
      "homepage": null,
      "paypalEmail": null
    }
  },
  "stats": {
    "installs": {
      "total": 9668,
      "weekly": 17
    },
    "rating": 4.0
  },
  "screenshots": {
    "main": {
      "name": "151435-0.webp",
      "archived": true
    },
    "additional": null
  },
  "obsolete": null,
  "style": {
    "css": "/* ==UserStyle==\r\n@name           theatre mode transparent chat- Twitch.tv\r\n@namespace      USO Archive\r\n@author         Vartan Bagdasaryan\r\n@description    `Transparent chat, theater / theater mode.Пишите отзывы пожелания.Feel Free to leave comment about improvements (code examples appreciated).FACEBOOK.com/Vartan.bg`\r\n@version        20230503.21.03\r\n@license        NO-REDISTRIBUTION\r\n@preprocessor   uso\r\n@advanced color chatColorPick \"Chat Color (pick)\" #FFFFFF\r\n@advanced dropdown chatTrans \"Chat transparency\" {\r\npart \"Partially (~30%)*\" <<<EOT #root div.tw-flex div.right-column.right-column--theatre{\r\nbackground: linear-gradient(to right, rgba(0,0,0,0) 5%,rgba(0,0,0,0.20) 30%,rgba(0,0,0,0.75) 75%)!important;\r\n} EOT;\r\nfully \"Fully\" <<<EOT #root div.tw-flex div.right-column.right-column--theatre{\r\nbackground: transparent!important;\r\n} EOT;\r\n\r\n}\r\n@advanced dropdown chatSize \"Chat size\" {\r\ndefault \"Default*\" <<<EOT .tw-root--theme-dark .simplebar-content .chat-list__list-container{\r\nfont-size: 12px;\r\n}\r\nEOT;\r\nsmall \"Small\" <<<EOT .tw-root--theme-dark .simplebar-content .chat-list__list-container{\r\nfont-size: 9px;\r\nline-height: 13px\r\n}\r\n\r\n.tw-root--theme-dark .right-column--theatre.right-column--beside {\r\nwidth: 26rem;\r\n}\r\n.tw-root--theme-dark .right-column--beside .channel-root__right-column {\r\nwidth: 26rem;\r\n} EOT;\r\nmedium \"Medium\" <<<EOT .tw-root--theme-dark .simplebar-content .chat-list__list-container{\r\nfont-size: 11px;\r\nline-height: 15px\r\n}\r\n\r\n.tw-root--theme-dark .right-column--theatre.right-column--beside {\r\nwidth: 26rem;\r\n}\r\n.tw-root--theme-dark .right-column--beside .channel-root__right-column {\r\nwidth: 26rem;\r\n} EOT;\r\n\r\n}\r\n\r\n==/UserStyle== */\r\n@-moz-document domain(www.twitch.tv) {\r\n    .tw-root--theme-dark .chat-room {\r\n        background: transparent !important;\r\n        text-shadow: black 1px 1px 0, black -1px -1px 0, black -1px 1px 0,\r\n            black 1px -1px 0 !important;\r\n    }\r\n\r\n    .tw-root--theme-dark .channel-root__right-column {\r\n        background: transparent !important;\r\n        text-shadow: black 1px 1px 0, black -1px -1px 0, black -1px 1px 0,\r\n            black 1px -1px 0 !important;\r\n    }\r\n\r\n    .tw-root--theme-dark .channel-root__right-column>div {\r\n        background: transparent !important;\r\n        text-shadow: black 1px 1px 0, black -1px -1px 0, black -1px 1px 0,\r\n            black 1px -1px 0 !important;\r\n    }\r\n\r\n    .whispers--theatre-mode.whispers--right-column-expanded {\r\n        right: 46rem !important;\r\n    }\r\n\r\n    .tw-root--theme-dark .pl-controls-top {\r\n        background: transparent;\r\n        text-shadow: black 1px 1px 0, black -1px -1px 0, black -1px 1px 0,\r\n            black 1px -1px 0 !important;\r\n    }\r\n\r\n    .tw-root--theme-dark .channel-page__right-column {\r\n        background-color: transparent !important;\r\n        text-shadow: black 1px 1px 0, black -1px -1px 0, black -1px 1px 0,\r\n            black 1px -1px 0 !important;\r\n    }\r\n\r\n    .tw-theme--dark .channel-page__right-column {\r\n        background-color: transparent !important;\r\n        text-shadow: black 1px 1px 0, black -1px -1px 0, black -1px 1px 0,\r\n            black 1px -1px 0 !important;\r\n    }\r\n\r\n    .tw-theme--dark .tw-c-background-alt-2 {\r\n        background-color: transparent !important;\r\n        text-shadow: black 1px 1px 0, black -1px -1px 0, black -1px 1px 0,\r\n            black 1px -1px 0 !important;\r\n    }\r\n\r\n    .tw-theme--dark .c-background-alt-2 {\r\n        background-color: transparent !important;\r\n        text-shadow: black 1px 1px 0, black -1px -1px 0, black -1px 1px 0,\r\n            black 1px -1px 0 !important;\r\n    }\r\n\r\n    .tw-theme--dark .chat__pane {\r\n        background-color: transparent !important;\r\n        text-shadow: black 1px 1px 0, black -1px -1px 0, black -1px 1px 0,\r\n            black 1px -1px 0 !important;\r\n    }\r\n\r\n    .tw-theme--dark .chat-room__pane {\r\n        background-color: transparent !important;\r\n        text-shadow: black 1px 1px 0, black -1px -1px 0, black -1px 1px 0,\r\n            black 1px -1px 0 !important;\r\n        border: none !important;\r\n    }\r\n\r\n    .tw-theme--dark .chat__header {\r\n        background-color: transparent !important;\r\n        text-shadow: black 1px 1px 0, black -1px -1px 0, black -1px 1px 0,\r\n            black 1px -1px 0 !important;\r\n        border: none !important;\r\n    }\r\n\r\n    .tw-theme--dark .chat-room__header {\r\n        background-color: transparent !important;\r\n        text-shadow: black 1px 1px 0, black -1px -1px 0, black -1px 1px 0,\r\n            black 1px -1px 0 !important;\r\n        border: none !important;\r\n    }\r\n\r\n    .tw-theme--dark .chat__pane {\r\n        border: none !important;\r\n    }\r\n\r\n    .tw-theme--dark .tw-textarea {\r\n        background-color: transparent;\r\n        text-shadow: black 1px 1px 0, black -1px -1px 0, black -1px 1px 0,\r\n            black 1px -1px 0 !important;\r\n    }\r\n\r\n    .tw-theme--dark .pinned-cheer__bounding-box {\r\n        background-color: transparent;\r\n        text-shadow: black 1px 1px 0, black -1px -1px 0, black -1px 1px 0,\r\n            black 1px -1px 0 !important;\r\n        border: none !important;\r\n    }\r\n\r\n    .theme--dark .channel-page__right-column {\r\n        background-color: transparent !important;\r\n        text-shadow: black 1px 1px 0, black -1px -1px 0, black -1px 1px 0,\r\n            black 1px -1px 0 !important;\r\n    }\r\n\r\n    .theme--dark .tw-c-background-alt-2 {\r\n        background-color: transparent !important;\r\n        text-shadow: black 1px 1px 0, black -1px -1px 0, black -1px 1px 0,\r\n            black 1px -1px 0 !important;\r\n    }\r\n\r\n    .theme--dark .c-background-alt-2 {\r\n        background-color: transparent !important;\r\n        text-shadow: black 1px 1px 0, black -1px -1px 0, black -1px 1px 0,\r\n            black 1px -1px 0 !important;\r\n    }\r\n\r\n    .theme--dark .chat__pane {\r\n        background-color: transparent !important;\r\n        text-shadow: black 1px 1px 0, black -1px -1px 0, black -1px 1px 0,\r\n            black 1px -1px 0 !important;\r\n    }\r\n\r\n    .theme--dark .chat-room__pane {\r\n        background-color: transparent !important;\r\n        text-shadow: black 1px 1px 0, black -1px -1px 0, black -1px 1px 0,\r\n            black 1px -1px 0 !important;\r\n        border: none !important;\r\n    }\r\n\r\n    .channel-page__video-player--theatre-mode {\r\n        width: 100% !important;\r\n    }\r\n\r\n    .theme--dark .chat__header {\r\n        background-color: transparent !important;\r\n        text-shadow: black 1px 1px 0, black -1px -1px 0, black -1px 1px 0,\r\n            black 1px -1px 0 !important;\r\n        border: none !important;\r\n    }\r\n\r\n    .theme--dark .chat-room__header {\r\n        background-color: transparent !important;\r\n        text-shadow: black 1px 1px 0, black -1px -1px 0, black -1px 1px 0,\r\n            black 1px -1px 0 !important;\r\n        border: none !important;\r\n    }\r\n\r\n    .theme--dark .chat__pane {\r\n        border: none !important;\r\n    }\r\n\r\n    .theme--dark .tw-textarea {\r\n        background-color: transparent;\r\n    }\r\n\r\n    .right-column--theatre .simplebar-content {\r\n        text-align: right;\r\n    }\r\n\r\n    .video-player--theatre .player-buttons-right {\r\n        right: 33rem !important;\r\n    }\r\n\r\n    .video-player--theatre.video-player--logged-in .video-player__container {\r\n        bottom: 0 !important;\r\n    }\r\n\r\n    .persistent-player.persistent-player--theatre {\r\n        width: 100% !important;\r\n    }\r\n\r\n    .theme--dark .pinned-cheer__bounding-box {\r\n        background-color: transparent;\r\n        border: none !important;\r\n    }\r\n\r\n    .tw-root--theme-dark .tw-c-background-base {\r\n        background-color: rgba(0, 0, 0, 0.6) !important;\r\n    }\r\n\r\n    .tw-root--theme-dark .tw-border-l {\r\n        background: none !important;\r\n    }\r\n\r\n    .tw-theme--dark .tw-border-l {\r\n        border-left: none !important;\r\n    }\r\n\r\n    .tw-theme--dark .pl-controls-top {\r\n        background: none !important;\r\n    }\r\n\r\n    .tw-theme--dark .tw-c-text {\r\n        text-shadow: black 1px 1px 0, black -1px -1px 0, black -1px 1px 0,\r\n            black 1px -1px 0 !important;\r\n    }\r\n\r\n    .tw-theme--dark .tw-c-background {\r\n        background: none !important;\r\n    }\r\n\r\n    .tw-theme--dark .vod-message.vod-message--focused,\r\n    .tw-theme--dark .vod-message:hover {\r\n        background: transparent !important;\r\n        text-shadow: black 1px 1px 0, black -1px -1px 0, black -1px 1px 0,\r\n            black 1px -1px 0 !important;\r\n    }\r\n\r\n    \r\n    \r\n    .tw-root--theme-dark .chat-input__textarea {\r\n        background: transparent!important;\r\n    }\r\n    \r\n    .tw-root--theme-dark .community-highlight.community-highlight.community-highlight {\r\n        background-color: rgba(24, 24, 27, 0.5)!important;\r\n        backdrop-filter: none!important\r\n    }\r\n    .tw-root--theme-dark .chat-room .chat-input-tray__open.chat-input-tray__open.chat-input-tray__open {\r\n        background: rgba(24, 24, 27, 0.7)!important;\r\n    }\r\n    .tw-root--theme-dark .fubBdX.fubBdX.fubBdX {\r\n    background-color: #5c16c58f !important;\r\n    }\r\n    .tw-root--theme-dark, :root {\r\n\r\n        --color-brand-muted-ice: #d6e4ff80!important;\r\n        --color-brand-muted-cupcake: #ffa3ee80!important;\r\n        --color-brand-muted-mint: #5cffbe80!important;\r\n        --color-brand-muted-sky: #7aa7ff80!important;\r\n        --color-brand-muted-blush: #ffcdcc80!important;\r\n        --color-brand-muted-canary: #ebeb0080!important;\r\n        --color-brand-muted-smoke: #d3d3d980!important;\r\n        --color-brand-muted-lavender: #d1b3ff80!important;\r\n        --color-brand-muted-mustard: #ffd37a80!important;\r\n        --color-brand-muted-emerald: #00f59380!important;\r\n        --color-brand-muted-coral: #ff828080!important;\r\n        --color-brand-muted-ocean: #1345aa80!important;\r\n        --color-brand-accent-grape: #5c16c580!important;\r\n        --color-brand-accent-dragonfruit: #ff38db80!important;\r\n        --color-brand-accent-carrot: #e6990080!important;\r\n        --color-brand-accent-sun: #ebeb0080!important;\r\n        --color-brand-accent-lime: #00f59380!important;\r\n        --color-brand-accent-turquoise: #00f0f080!important;\r\n        --color-brand-accent-eggplant: #45109380!important;\r\n        --color-brand-accent-wine: #ae139280!important;\r\n        --color-brand-accent-slime: #00f59380!important;\r\n        --color-brand-accent-seafoam: #5cffbe80!important;\r\n        --color-brand-accent-cherry: #eb040080!important;\r\n        --color-brand-accent-marine: #1f69ff80!important;\r\n        --color-brand-accent-seaweed: #00a3a380!important;\r\n        --color-brand-accent-pebble: #84849480!important;\r\n        --color-brand-accent-moon: #efeff180!important;\r\n        --color-brand-accent-fiji: #5cffbe80!important;\r\n        --color-brand-accent-blueberry: #1f69ff80!important;\r\n        --color-brand-accent-arctic: #00f0f080!important;\r\n        --color-brand-accent-highlighter: #f5f50080!important;\r\n        --color-brand-accent-flamingo: #ff38db80!important;\r\n        --color-brand-accent-ruby: #eb040080!important;\r\n        --color-brand-accent-punch: #ffcdcc80!important;\r\n        --color-brand-accent-creamsicle: #ffd37a80!important;\r\n        --color-white: #fff80!important;\r\n        --color-black: #00080!important;\r\n        --color-red: #e9191680!important;\r\n        --color-red-darker: #bb141180!important;\r\n        --color-orange: #ffd37a80!important;\r\n        --color-yellow: #ffd37a80!important;\r\n        --color-green: #00f59380!important;\r\n        --color-green-darker: #00ad9680!important;\r\n        --color-blue: #1f69ff80!important;\r\n        --color-prime-blue: #0e9bd880!important;\r\n        --color-magenta: #c53dff80!important;\r\n        --color-error: #eb040080!important;\r\n        --color-warn: #ffd37a80!important;\r\n        --color-success: #00f59380!important;\r\n        --color-info: #1f69ff80!important;\r\n        --color-accent: #9147ff80!important;\r\n        --color-twitch-purple: #9147ff80!important;\r\n        --color-twitch-purple-1: #04010980!important;\r\n        --color-twitch-purple-2: #0d031c80!important;\r\n        --color-twitch-purple-3: #15052e80!important;\r\n        --color-twitch-purple-4: #24094e80!important;\r\n        --color-twitch-purple-5: #330c6e80!important;\r\n        --color-twitch-purple-6: #45109380!important;\r\n        --color-twitch-purple-7: #5c16c580!important;\r\n        --color-twitch-purple-8: #772ce880!important;\r\n        --color-twitch-purple-9: #9147ff80!important;\r\n        --color-twitch-purple-10: #a970ff80!important;\r\n        --color-twitch-purple-11: #bf94ff80!important;\r\n        --color-twitch-purple-12: #d1b3ff80!important;\r\n        --color-twitch-purple-13: #e3d1ff80!important;\r\n        --color-twitch-purple-14: #ede0ff80!important;\r\n        --color-twitch-purple-15: #f3ebff80!important;\r\n        --color-hinted-grey-1: #0e0e1080!important;\r\n        --color-hinted-grey-2: #18181b80!important;\r\n        --color-hinted-grey-3: #1f1f2380!important;\r\n        --color-hinted-grey-4: #26262c80!important;\r\n        --color-hinted-grey-5: #32323980!important;\r\n        --color-hinted-grey-6: #3b3b4480!important;\r\n        --color-hinted-grey-7: #53535f80!important;\r\n        --color-hinted-grey-8: #84849480!important;\r\n        --color-hinted-grey-9: #adadb880!important;\r\n        --color-hinted-grey-10: #c8c8d080!important;\r\n        --color-hinted-grey-11: #d3d3d980!important;\r\n        --color-hinted-grey-12: #dedee380!important;\r\n        --color-hinted-grey-13: #e6e6ea80!important;\r\n        --color-hinted-grey-14: #efeff180!important;\r\n        --color-hinted-grey-15: #f7f7f880!important;\r\n                \r\n        --color-text-button: #fff!important;\r\n        --color-text-button-hover: #fff!important;\r\n        --color-text-button-focus: #fff!important;\r\n        --color-text-button-active: #fff!important;\r\n        --color-text-button-secondary-hover: #3b3b44!important;\r\n        --color-text-button-secondary-focus: #3b3b44!important;\r\n        --color-text-button-secondary-active: #3b3b44!important;\r\n        --color-text-button-text-focus: var(--color-opac-w-1);\r\n        --color-text-button-text-active: var(--color-opac-p-2);\r\n        --color-text-button-status: #fff!important;\r\n        --color-text-button-status-hover: #fff!important;\r\n        --color-text-button-status-focus: #fff!important;\r\n        --color-text-button-status-active: #fff!important;\r\n        --color-text-button-success-hover: #000!important;\r\n        --color-text-button-success-focus: #000!important;\r\n        --color-text-button-success-active: #000!important;\r\n        --color-text-button-alert: #000!important;\r\n        --color-text-button-alert-hover: #000!important;\r\n        --color-text-button-alert-focus: #000!important;\r\n        --color-text-button-alert-active: #000!important;\r\n        --color-text-button-overlay: #fff!important;\r\n        --color-text-button-overlay-hover: #fff!important;\r\n        --color-text-button-overlay-focus: #fff!important;\r\n        --color-text-button-overlay-active: #fff!important;\r\n        --color-text-interactable: currentColor;\r\n        --color-text-interactable-hover: #fff!important;\r\n        --color-text-interactable-active: #fff!important;\r\n        --color-text-interactable-inverted: #fff!important;\r\n        --color-text-input-focus: transparent;\r\n        \r\n    --color-text-base: #efeff1!important;\r\n    --color-text-alt: #dedee3!important;\r\n    --color-text-alt-2: #adadb8!important;\r\n    --color-text-link: #bf94ff!important;\r\n    --color-text-link-hover: #a970ff!important;\r\n    --color-text-link-active: #bf94ff!important;\r\n    --color-text-link-focus: #a970ff!important;\r\n    --color-text-link-visited: #bf94ff!important;\r\n    --color-text-live: var(--color-text-accessible-red);\r\n    --color-text-alert: var(--color-text-accessible-red);\r\n    --color-text-prime: #0e9bd8!important;\r\n    --color-text-error: var(--color-red-11);\r\n    --color-text-warn: var(--color-orange-11);\r\n    --color-text-success: var(--color-green-11);\r\n    --color-text-info: var(--color-blue-11);\r\n    --color-text-brand: #bf94ff!important;\r\n    --color-text-overlay-error: var(--color-red-11);\r\n    --color-text-overlay-warn: var(--color-orange-11);\r\n    --color-text-overlay-success: var(--color-green-11);\r\n    --color-text-overlay-info: var(--color-blue-11);\r\n    --color-text-overlay-brand: #fff!important;\r\n    --color-text-accessible-red: var(--color-red-11);\r\n    --color-text-accessible-green: var(--color-green-11);\r\n    --color-text-accessible-blue: var(--color-blue-11);\r\n    --color-text-tab: var(--color-text-base);\r\n    --color-text-tab-active: #bf94ff!important;\r\n    --color-text-badge-alt: #000!important;\r\n    --color-text-badge-alt-2: #000!important;\r\n    --color-text-button-primary: #fff!important;\r\n    --color-text-button-secondary: var(--color-text-base);\r\n    --color-text-button-text: var(--color-text-brand);\r\n    --color-text-button-text-hover: var(--color-text-base);\r\n    --color-text-button-destructive: var(--color-text-button-error);\r\n    --color-text-button-error: #000!important;\r\n    --color-text-button-warn: #000!important;\r\n    --color-text-button-success: #000!important;\r\n    --color-text-button-info: #000!important;\r\n    --color-text-button-brand: #fff!important;\r\n    --color-text-button-overlay-primary: #000!important;\r\n    --color-text-button-overlay-secondary: #fff!important;\r\n    --color-text-button-overlay-text: #fff!important;\r\n    --color-text-button-overlay-error: #000!important;\r\n    --color-text-button-overlay-warn: #000!important;\r\n    --color-text-button-overlay-success: #000!important;\r\n    --color-text-button-overlay-info: #000!important;\r\n    --color-text-button-overlay-brand: #000!important;\r\n    --color-text-button-disabled: #adadb8!important;\r\n    --color-text-interactable-selected: var(--color-text-overlay);\r\n    --color-text-interactable-overlay-selected: #000!important;\r\n    --color-text-input: var(--color-text-base);\r\n    --color-text-input-placeholder: var(--color-opac-w-10);\r\n    --color-text-input-placeholder-overlay: var(--color-opac-w-10);\r\n    --color-text-input-checked-icon: #fff!important;\r\n    --color-text-keyboard-prompt: var(--color-text-alt-2);\r\n    --color-text-keyboard-prompt-tooltip: var(--color-hinted-grey-7);\r\n    --color-text-label: var(--color-hinted-grey-15);\r\n    --color-text-label-optional: var(--color-hinted-grey-8);\r\n    --color-text-hint: var(--color-hinted-grey-8);\r\n    --color-text-tag: var(--color-text-alt-2);\r\n    --color-text-toggle-checked-icon: var(--color-border-brand);\r\n    --color-text-toggle-checked-icon-overlay: #fff!important;\r\n    --color-text-tooltip: var(--color-hinted-grey-1);\r\n    --color-text-overlay: #fff!important;\r\n    --color-text-overlay-alt: var(--color-opac-w-13);\r\n    --color-text-overlay-link: #fff!important;\r\n    --color-text-overlay-link-hover: var(--color-opac-w-12);\r\n    --color-text-overlay-link-active: #fff!important;\r\n    --color-text-overlay-link-focus: var(--color-opac-w-12);\r\n    --color-text-overlay-link-visited: #fff!important;\r\n    --color-text-pill: #000!important;\r\n    --color-text-chat-line-mentioning: #fff!important;\r\n    --color-text-chat-line-mentioned: var(--color-hinted-grey-2);\r\n    --color-text-channel-status-text-indicator-hosting: #000!important;\r\n    --color-text-channel-status-text-indicator-rerun: #000!important;\r\n    --color-text-channel-status-text-indicator-offline: #000!important;\r\n    --color-text-channel-status-text-indicator-hosting-overlay: #000!important;\r\n    --color-text-channel-status-text-indicator-rerun-overlay: #000!important;\r\n    --color-text-channel-status-text-indicator-offline-overlay: #000!important;\r\n    --color-text-ribbon: #fff!important;\r\n        \r\n    }\r\n\r\n    .tw-root--theme-dark .font-scale--default {\r\n        background: transparent!important;\r\n    }\r\n\r\n     .tw-root--theme-dark .chat-wysiwyg-input__editor,  .tw-root--theme-dark .chat-wysiwyg-input__editor:hover {\r\n        background-color: rgba(24, 24, 27, 0.5)!important;\r\n    }\r\n\r\n    .tw-root--theme-dark .tw-c-background-alt-2 {\r\n        background-color: transparent !important;\r\n        text-shadow: black 1px 1px 0, black -1px -1px 0, black -1px 1px 0,\r\n            black 1px -1px 0 !important;\r\n    }\r\n\r\n    .tw-root--theme-dark .tw-border-l {\r\n        border-left: 1px solid transparent !important;\r\n    }\r\n\r\n    .tw-root--theme-dark .tw-textarea {\r\n        background: transparent;\r\n        text-shadow: black 1px 1px 0, black -1px -1px 0, black -1px 1px 0,\r\n            black 1px -1px 0 !important;\r\n    }\r\n\r\n    .tw-root--theme-dark .tw-c-background-alt {\r\n        background-color: transparent !important;\r\n        text-shadow: black 1px 1px 0, black -1px -1px 0, black -1px 1px 0,\r\n            black 1px -1px 0 !important;\r\n    }\r\n\r\n    .tw-root--theme-dark .tw-c-background-base.whispers-thread,\r\n    .whispers-thread--focused {\r\n        background-color: #19171c !important;\r\n    }\r\n\r\n    .tw-root--theme-dark .tw-c-background-base.whispers-threads-box__container,\r\n    .whispers-threads-box__container--open {\r\n        background-color: #19171c !important;\r\n    }\r\n\r\n    #default-player>div>div.hover-display div.pl-controls-bottom {\r\n        padding-right: 34rem !important;\r\n    }\r\n\r\n    .tw-theme--dark .vod-message.vod-message--focused,\r\n    .tw-theme--dark .vod-message,\r\n    .tw-root--theme-dark .tw-c-text-base {\r\n        color: #ffffff !important;\r\n        text-shadow: black 1px 1px 0, black -1px -1px 0, black -1px 1px 0,\r\n            black 1px -1px 0 !important;\r\n        text-align: right;\r\n    }\r\n\r\n    .tw-root--theme-dark .chat-settings {\r\n        background-color: #19171c !important;\r\n    }\r\n\r\n    .tw-root--theme-dark .stream-chat-header {\r\n        background-color: transparent !important;\r\n    }\r\n\r\n    .tw-root--theme-dark .highwind-video-player__container--theatre-whispers {\r\n        bottom: 0 !important;\r\n    }\r\n\r\n    .tw-root--theme-dark .player-controls__right-control-group {\r\n        margin-right: 30%;\r\n    }\r\n\r\n    #root div.tw-flex div.right-column.right-column--theatre {\r\n        background: linear-gradient(to right,\r\n                rgba(0, 0, 0, 0) 5%,\r\n                rgba(0, 0, 0, 0.2) 30%,\r\n                rgba(0, 0, 0, 0.75) 75%) !important;\r\n    }\r\n\r\n    .tw-root--theme-dark .simplebar-content .chat-list__list-container {\r\n        font-size: 12px;\r\n    }\r\n\r\n    .tw-root--theme-dark div.persistent-player.persistent-player--theatre .video-player>div {\r\n        bottom: 0rem;\r\n    }\r\n\r\n    .tw-root--theme-dark div.persistent-player.persistent-player--theatre div.video-player__default-player>.tw-absolute {\r\n        bottom: 0em !important;\r\n    }\r\n\r\n    /*[[chatTrans]]*/\r\n    /*[[chatSize]]*/\r\n}",
    "settings": [
      {
        "key": "chatColorPick",
        "label": "Chat Color (pick)",
        "type": "color",
        "options": [
          {
            "key": "placeholder",
            "label": "placeholder",
            "value": "#FFFFFF",
            "default": true
          }
        ]
      },
      {
        "key": "chatTrans",
        "label": "Chat transparency",
        "type": "dropdown",
        "options": [
          {
            "key": "fully",
            "label": "Fully",
            "value": "#root div.tw-flex div.right-column.right-column--theatre{\r\n    background: transparent!important;\r\n}",
            "default": false
          },
          {
            "key": "part",
            "label": "Partially (~30%)",
            "value": "#root div.tw-flex div.right-column.right-column--theatre{\r\nbackground: linear-gradient(to right, rgba(0,0,0,0) 5%,rgba(0,0,0,0.20) 30%,rgba(0,0,0,0.75) 75%)!important;\r\n}",
            "default": true
          }
        ]
      },
      {
        "key": "chatSize",
        "label": "Chat size",
        "type": "dropdown",
        "options": [
          {
            "key": "default",
            "label": "Default",
            "value": ".tw-root--theme-dark .simplebar-content .chat-list__list-container{\r\n    font-size: 12px;\r\n}\r\n",
            "default": true
          },
          {
            "key": "small",
            "label": "Small",
            "value": ".tw-root--theme-dark .simplebar-content .chat-list__list-container{\r\n    font-size: 9px;\r\n    line-height: 13px\r\n}\r\n\r\n.tw-root--theme-dark .right-column--theatre.right-column--beside {\r\n    width: 26rem;\r\n}\r\n.tw-root--theme-dark .right-column--beside .channel-root__right-column {\r\n    width: 26rem;\r\n}",
            "default": false
          },
          {
            "key": "medium",
            "label": "Medium",
            "value": ".tw-root--theme-dark .simplebar-content .chat-list__list-container{\r\n    font-size: 11px;\r\n    line-height: 15px\r\n}\r\n\r\n.tw-root--theme-dark .right-column--theatre.right-column--beside {\r\n    width: 26rem;\r\n}\r\n.tw-root--theme-dark .right-column--beside .channel-root__right-column {\r\n    width: 26rem;\r\n}",
            "default": false
          }
        ]
      }
    ]
  },
  "deleteReason": null
}